[
  {
    "contract_version": "0.2.0",
    "delivery_id": "delivery:ad-view-33",
    "record_id": "ad-view-33",
    "canonical_record_id": "ad-view-33",
    "tenant_id": "tenant-a",
    "app_id": "app-a",
    "received_at": "2026-07-31T13:00:01.000Z",
    "ingestion_status": "accepted",
    "duplicate_resolution": "unique",
    "timeliness": "on_time",
    "clock_skew_suspected": false,
    "payload_disposition": "protected",
    "processing_purpose_id": "analytics",
    "consent_evaluation_policy_version": "consent-v0.2",
    "consent_decision_reason_code": "consent_not_required"
  },
  {
    "contract_version": "0.2.0",
    "delivery_id": "delivery:aggregate-revenue-33",
    "record_id": "aggregate-revenue-33",
    "canonical_record_id": "aggregate-revenue-33",
    "tenant_id": "tenant-a",
    "app_id": "app-a",
    "received_at": "2026-08-02T12:00:01.000Z",
    "ingestion_status": "accepted",
    "duplicate_resolution": "unique",
    "timeliness": "on_time",
    "clock_skew_suspected": false,
    "payload_disposition": "protected",
    "processing_purpose_id": "analytics",
    "consent_evaluation_policy_version": "consent-v0.2",
    "consent_decision_reason_code": "consent_not_required"
  },
  {
    "contract_version": "0.2.0",
    "delivery_id": "delivery:click-33",
    "record_id": "click-33",
    "canonical_record_id": "click-33",
    "tenant_id": "tenant-a",
    "app_id": "app-a",
    "received_at": "2026-07-31T12:00:01.000Z",
    "ingestion_status": "accepted",
    "duplicate_resolution": "unique",
    "timeliness": "on_time",
    "clock_skew_suspected": false,
    "payload_disposition": "protected",
    "processing_purpose_id": "analytics",
    "consent_evaluation_policy_version": "consent-v0.2",
    "consent_decision_reason_code": "consent_not_required"
  },
  {
    "contract_version": "0.2.0",
    "delivery_id": "delivery:install-33",
    "record_id": "install-33",
    "canonical_record_id": "install-33",
    "tenant_id": "tenant-a",
    "app_id": "app-a",
    "received_at": "2026-08-01T00:00:01.000Z",
    "ingestion_status": "accepted",
    "duplicate_resolution": "unique",
    "timeliness": "on_time",
    "clock_skew_suspected": false,
    "payload_disposition": "protected",
    "processing_purpose_id": "analytics",
    "consent_evaluation_policy_version": "consent-v0.2",
    "consent_decision_reason_code": "consent_not_required"
  },
  {
    "contract_version": "0.2.0",
    "delivery_id": "delivery:revenue-33-a",
    "record_id": "revenue-33-a",
    "canonical_record_id": "revenue-33-a",
    "tenant_id": "tenant-a",
    "app_id": "app-a",
    "received_at": "2026-08-01T12:00:01.000Z",
    "ingestion_status": "accepted",
    "duplicate_resolution": "unique",
    "timeliness": "on_time",
    "clock_skew_suspected": false,
    "payload_disposition": "protected",
    "processing_purpose_id": "analytics",
    "consent_evaluation_policy_version": "consent-v0.2",
    "consent_decision_reason_code": "consent_not_required"
  },
  {
    "contract_version": "0.2.0",
    "delivery_id": "delivery:revenue-33-b",
    "record_id": "revenue-33-b",
    "canonical_record_id": "revenue-33-b",
    "tenant_id": "tenant-a",
    "app_id": "app-a",
    "received_at": "2026-08-03T00:00:01.000Z",
    "ingestion_status": "accepted",
    "duplicate_resolution": "unique",
    "timeliness": "on_time",
    "clock_skew_suspected": false,
    "payload_disposition": "protected",
    "processing_purpose_id": "analytics",
    "consent_evaluation_policy_version": "consent-v0.2",
    "consent_decision_reason_code": "consent_not_required"
  },
  {
    "contract_version": "0.2.0",
    "delivery_id": "delivery:revenue-33-c",
    "record_id": "revenue-33-c",
    "canonical_record_id": "revenue-33-c",
    "tenant_id": "tenant-a",
    "app_id": "app-a",
    "received_at": "2026-08-07T00:00:01.000Z",
    "ingestion_status": "accepted",
    "duplicate_resolution": "unique",
    "timeliness": "on_time",
    "clock_skew_suspected": false,
    "payload_disposition": "protected",
    "processing_purpose_id": "analytics",
    "consent_evaluation_policy_version": "consent-v0.2",
    "consent_decision_reason_code": "consent_not_required"
  },
  {
    "contract_version": "0.2.0",
    "delivery_id": "delivery:session-33-d1",
    "record_id": "session-33-d1",
    "canonical_record_id": "session-33-d1",
    "tenant_id": "tenant-a",
    "app_id": "app-a",
    "received_at": "2026-08-02T00:00:01.000Z",
    "ingestion_status": "accepted",
    "duplicate_resolution": "unique",
    "timeliness": "on_time",
    "clock_skew_suspected": false,
    "payload_disposition": "protected",
    "processing_purpose_id": "analytics",
    "consent_evaluation_policy_version": "consent-v0.2",
    "consent_decision_reason_code": "consent_not_required"
  },
  {
    "contract_version": "0.2.0",
    "delivery_id": "delivery:session-33-d7",
    "record_id": "session-33-d7",
    "canonical_record_id": "session-33-d7",
    "tenant_id": "tenant-a",
    "app_id": "app-a",
    "received_at": "2026-08-08T00:00:01.000Z",
    "ingestion_status": "accepted",
    "duplicate_resolution": "unique",
    "timeliness": "on_time",
    "clock_skew_suspected": false,
    "payload_disposition": "protected",
    "processing_purpose_id": "analytics",
    "consent_evaluation_policy_version": "consent-v0.2",
    "consent_decision_reason_code": "consent_not_required"
  }
]
