[
  {
    "contract_version": "0.2.0",
    "delivery_id": "delivery:aak-crowd-34",
    "record_id": "aak-crowd-34",
    "canonical_record_id": "aak-crowd-34",
    "tenant_id": "tenant-a",
    "app_id": "app-a",
    "received_at": "2026-08-18T10:00:01.000Z",
    "ingestion_status": "accepted",
    "duplicate_resolution": "unique",
    "timeliness": "on_time",
    "clock_skew_suspected": false,
    "payload_disposition": "protected",
    "processing_purpose_id": "analytics",
    "consent_evaluation_policy_version": "consent-v0.2",
    "consent_decision_reason_code": "consent_not_required"
  },
  {
    "contract_version": "0.2.0",
    "delivery_id": "delivery:aak-not-winner-34",
    "record_id": "aak-not-winner-34",
    "canonical_record_id": "aak-not-winner-34",
    "tenant_id": "tenant-a",
    "app_id": "app-a",
    "received_at": "2026-08-18T09:00:01.000Z",
    "ingestion_status": "accepted",
    "duplicate_resolution": "unique",
    "timeliness": "on_time",
    "clock_skew_suspected": false,
    "payload_disposition": "protected",
    "processing_purpose_id": "analytics",
    "consent_evaluation_policy_version": "consent-v0.2",
    "consent_decision_reason_code": "consent_not_required"
  },
  {
    "contract_version": "0.2.0",
    "delivery_id": "delivery:aak-null-conversion-34",
    "record_id": "aak-null-conversion-34",
    "canonical_record_id": "aak-null-conversion-34",
    "tenant_id": "tenant-a",
    "app_id": "app-a",
    "received_at": "2026-08-18T11:00:01.000Z",
    "ingestion_status": "accepted",
    "duplicate_resolution": "unique",
    "timeliness": "on_time",
    "clock_skew_suspected": false,
    "payload_disposition": "protected",
    "processing_purpose_id": "analytics",
    "consent_evaluation_policy_version": "consent-v0.2",
    "consent_decision_reason_code": "consent_not_required"
  },
  {
    "contract_version": "0.2.0",
    "delivery_id": "delivery:adservices-expired-install-34",
    "record_id": "adservices-expired-install-34",
    "canonical_record_id": "adservices-expired-install-34",
    "tenant_id": "tenant-a",
    "app_id": "app-a",
    "received_at": "2026-08-18T06:00:01.000Z",
    "ingestion_status": "accepted",
    "duplicate_resolution": "unique",
    "timeliness": "on_time",
    "clock_skew_suspected": false,
    "payload_disposition": "protected",
    "processing_purpose_id": "analytics",
    "consent_evaluation_policy_version": "consent-v0.2",
    "consent_decision_reason_code": "consent_not_required"
  },
  {
    "contract_version": "0.2.0",
    "delivery_id": "delivery:adservices-install-34",
    "record_id": "adservices-install-34",
    "canonical_record_id": "adservices-install-34",
    "tenant_id": "tenant-a",
    "app_id": "app-a",
    "received_at": "2026-08-18T05:00:01.000Z",
    "ingestion_status": "accepted",
    "duplicate_resolution": "unique",
    "timeliness": "on_time",
    "clock_skew_suspected": false,
    "payload_disposition": "protected",
    "processing_purpose_id": "analytics",
    "consent_evaluation_policy_version": "consent-v0.2",
    "consent_decision_reason_code": "consent_not_required"
  },
  {
    "contract_version": "0.2.0",
    "delivery_id": "delivery:meta-absent-install-34",
    "record_id": "meta-absent-install-34",
    "canonical_record_id": "meta-absent-install-34",
    "tenant_id": "tenant-a",
    "app_id": "app-a",
    "received_at": "2026-08-18T04:00:01.000Z",
    "ingestion_status": "accepted",
    "duplicate_resolution": "unique",
    "timeliness": "on_time",
    "clock_skew_suspected": false,
    "payload_disposition": "protected",
    "processing_purpose_id": "analytics",
    "consent_evaluation_policy_version": "consent-v0.2",
    "consent_decision_reason_code": "consent_not_required"
  },
  {
    "contract_version": "0.2.0",
    "delivery_id": "delivery:meta-click-install-34",
    "record_id": "meta-click-install-34",
    "canonical_record_id": "meta-click-install-34",
    "tenant_id": "tenant-a",
    "app_id": "app-a",
    "received_at": "2026-08-18T01:00:01.000Z",
    "ingestion_status": "accepted",
    "duplicate_resolution": "unique",
    "timeliness": "on_time",
    "clock_skew_suspected": false,
    "payload_disposition": "protected",
    "processing_purpose_id": "analytics",
    "consent_evaluation_policy_version": "consent-v0.2",
    "consent_decision_reason_code": "consent_not_required"
  },
  {
    "contract_version": "0.2.0",
    "delivery_id": "delivery:meta-failed-install-34",
    "record_id": "meta-failed-install-34",
    "canonical_record_id": "meta-failed-install-34",
    "tenant_id": "tenant-a",
    "app_id": "app-a",
    "received_at": "2026-08-18T03:00:01.000Z",
    "ingestion_status": "accepted",
    "duplicate_resolution": "unique",
    "timeliness": "on_time",
    "clock_skew_suspected": false,
    "payload_disposition": "protected",
    "processing_purpose_id": "analytics",
    "consent_evaluation_policy_version": "consent-v0.2",
    "consent_decision_reason_code": "consent_not_required"
  },
  {
    "contract_version": "0.2.0",
    "delivery_id": "delivery:meta-view-install-34",
    "record_id": "meta-view-install-34",
    "canonical_record_id": "meta-view-install-34",
    "tenant_id": "tenant-a",
    "app_id": "app-a",
    "received_at": "2026-08-18T02:00:01.000Z",
    "ingestion_status": "accepted",
    "duplicate_resolution": "unique",
    "timeliness": "on_time",
    "clock_skew_suspected": false,
    "payload_disposition": "protected",
    "processing_purpose_id": "analytics",
    "consent_evaluation_policy_version": "consent-v0.2",
    "consent_decision_reason_code": "consent_not_required"
  },
  {
    "contract_version": "0.2.0",
    "delivery_id": "delivery:skan-invalid-34",
    "record_id": "skan-invalid-34",
    "canonical_record_id": "skan-invalid-34",
    "tenant_id": "tenant-a",
    "app_id": "app-a",
    "received_at": "2026-08-18T08:00:01.000Z",
    "ingestion_status": "accepted",
    "duplicate_resolution": "unique",
    "timeliness": "on_time",
    "clock_skew_suspected": false,
    "payload_disposition": "protected",
    "processing_purpose_id": "analytics",
    "consent_evaluation_policy_version": "consent-v0.2",
    "consent_decision_reason_code": "consent_not_required"
  },
  {
    "contract_version": "0.2.0",
    "delivery_id": "delivery:skan-verified-34",
    "record_id": "skan-verified-34",
    "canonical_record_id": "skan-verified-34",
    "tenant_id": "tenant-a",
    "app_id": "app-a",
    "received_at": "2026-08-18T07:00:01.000Z",
    "ingestion_status": "accepted",
    "duplicate_resolution": "unique",
    "timeliness": "on_time",
    "clock_skew_suspected": false,
    "payload_disposition": "protected",
    "processing_purpose_id": "analytics",
    "consent_evaluation_policy_version": "consent-v0.2",
    "consent_decision_reason_code": "consent_not_required"
  }
]
